{
  "v": "ACDC10JSON000177_",
  "d": "EBM2Z3aQrsx1FYEH4wkrZarMUGysUWIGFGb0dBffBL17",
  "i": "EIw_fe9e7TTGUL5nrXfjuzqzGWq7iHc4mzmGiqb_CCGK",
  "ri": "EAEBPOD8GzIYVKlElExZroScFvGbiKdLjbcJ4XuYeOQv",
  "s": "ED9ta8o1xTm3LR9apIj6ImS1wQEOcEUmMd19aUa7tjDL",
  "a": {
    "d": "EHfPLy-fEuPe3Ug9f8ZE2LTrzfcvF0pwnCV6UJK_ApoV",
    "dt": "2024-11-01T14:23:16+00:00",
    "xsaid": "EGvjHeAo7ZRQYUCb3Xh9TBdLhoMuW4lBSmOeR6gkMhMg"
  }
}